{
  "name": "Rickz",
  "fullName": "Henrique Reis",
  "handle": "rickyz-120",
  "url": "https://rickyz-120.github.io",
  "role": {
    "pt": "Analista de dados",
    "en": "Data analyst"
  },
  "tagline": {
    "pt": "Transformando dados em jogadas.",
    "en": "Turning data into plays."
  },
  "about": {
    "draft": false,
    "paragraphs": {
      "pt": [
        "Estou no 8º período de Ciência de Dados na FAE e trabalho como analista de BI no Grupo SOMA.",
        "Gosto de pegar números soltos e transformar em algo que dá para entender e decidir. Este espaço vai contar quem eu sou, o que já fiz e para onde quero ir."
      ],
      "en": [
        "I am in the 8th semester of Data Science at FAE and work as a BI analyst at Grupo SOMA.",
        "I like taking loose numbers and turning them into something people can understand and act on. This space will tell who I am, what I have built and where I want to go."
      ]
    }
  },
  "photo": null,
  "links": {
    "github": "https://github.com/rickyz-120",
    "linkedin": "https://www.linkedin.com/in/henrique-reis-br/",
    "kaggle": "https://www.kaggle.com/rickyz120",
    "email": "rickyzstudy@gmail.com"
  },
  "cv": {
    "available": false,
    "file": "assets/cv/Henrique-Reis-CV.pdf"
  },
  "analytics": {
    "provider": null,
    "siteId": null
  },
  "showDraftBadges": true,
  "ogImage": "assets/img/og-image.png",
  "seo": {
    "title": {
      "pt": "Rickz · Henrique Reis, analista de dados",
      "en": "Rickz · Henrique Reis, data analyst"
    },
    "description": {
      "pt": "Portfólio do Henrique Reis (Rickz): projetos de dados com Power BI, SQL, Python e R.",
      "en": "Portfolio of Henrique Reis (Rickz): data projects with Power BI, SQL, Python and R."
    }
  }
}
